{"contractSha256":"122b3a42d75f9e9a0b473c9c2c38814cce3dc4239d27bb935af183c7e9fd43e9","hardware":{"browser":"Chromium 140.0.7339.80","gpu":"LeDeluge NVIDIA GeForce RTX 4090 Laptop GPU (16 GB)","runtime":"Browser WebGPU only; CPU fallback disabled"},"rawSha256":"adb3bef07868ac7e1ba2e6a5cae032246df7b2638e07cef4a1ac462c61cb9f43","reportId":"raw/g5","schemaVersion":"metric-report/v2","signals":{"correction-magnitude":{"value":0.1},"coverage":{"value":0.95},"disocclusion-recovery-latency":{"value":120},"newly-revealed-area":{"value":0.1},"presentation-p95":{"value":20},"reset-frequency":{"value":0.02},"stale-result-rejection":{"value":0},"temporal-warp-error":{"value":0.01},"valid-pixel-error":{"value":0.01}},"source":{"kind":"performance-trace","path":"reports/evidence/raw/artifacts/g5.json","sha256":"d28300e9d26a6ea75f6813ab098afc12cc9d2e5bcc5271429423e60a1e396778"}}
